[
  {
    "kn_id": "kn_0001",
    "version": 1,
    "title_en": "Types of number",
    "title_zh": "数的类型",
    "domain": "number",
    "subdomain": "s1.1",
    "tags": [],
    "examBoards": {
      "cie_0580": {
        "section": "s1.1",
        "kpId": "kp-1.1-01",
        "tier": "both",
        "weight": "medium"
      }
    },
    "prerequisites": [],
    "leadsTo": [],
    "difficultyRange": [
      1,
      3
    ],
    "estimatedMinutes": {
      "concept": 10,
      "practice": 15
    },
    "content": {
      "variants": {
        "cie": [],
        "edexcel": [],
        "generic": []
      },
      "missions": [],
      "glGeneratorId": null,
      "examRefs": {
        "cie": 0,
        "edexcel": 0
      }
    },
    "noFigure": true,
    "isFoundational": true,
    "deprecated": false,
    "createdAt": "2026-04-06T16:01:38Z",
    "updatedAt": "2026-04-06T16:01:38Z"
  },
  {
    "kn_id": "kn_0002",
    "version": 1,
    "title_en": "Types of number",
    "title_zh": "数的类型",
    "domain": "number",
    "subdomain": "s1.1",
    "tags": [],
    "examBoards": {
      "cie_0580": {
        "section": "s1.1",
        "kpId": "kp-1.1-02",
        "tier": "both",
        "weight": "medium"
      }
    },
    "prerequisites": [],
    "leadsTo": [],
    "difficultyRange": [
      1,
      3
    ],
    "estimatedMinutes": {
      "concept": 10,
      "practice": 15
    },
    "content": {
      "variants": {
        "cie": [],
        "edexcel": [],
        "generic": []
      },
      "missions": [],
      "glGeneratorId": null,
      "examRefs": {
        "cie": 0,
        "edexcel": 0
      }
    },
    "noFigure": true,
    "isFoundational": true,
    "deprecated": false,
    "createdAt": "2026-04-06T16:01:38Z",
    "updatedAt": "2026-04-06T16:01:38Z"
  },
  {
    "kn_id": "kn_0003",
    "version": 1,
    "title_en": "Types of number",
    "title_zh": "数的类型",
    "domain": "number",
    "subdomain": "s1.1",
    "tags": [],
    "examBoards": {
      "cie_0580": {
        "section": "s1.1",
        "kpId": "kp-1.1-06",
        "tier": "both",
        "weight": "medium"
      }
    },
    "prerequisites": [],
    "leadsTo": [],
    "difficultyRange": [
      1,
      3
    ],
    "estimatedMinutes": {
      "concept": 10,
      "practice": 15
    },
    "content": {
      "variants": {
        "cie": [],
        "edexcel": [],
        "generic": []
      },
      "missions": [],
      "glGeneratorId": null,
      "examRefs": {
        "cie": 0,
        "edexcel": 0
      }
    },
    "noFigure": true,
    "isFoundational": true,
    "deprecated": false,
    "createdAt": "2026-04-06T16:01:38Z",
    "updatedAt": "2026-04-06T16:01:38Z"
  },
  {
    "kn_id": "kn_0004",
    "version": 1,
    "title_en": "Types of number",
    "title_zh": "数的类型",
    "domain": "number",
    "subdomain": "s1.1",
    "tags": [],
    "examBoards": {
      "cie_0580": {
        "section": "s1.1",
        "kpId": "kp-1.1-04",
        "tier": "both",
        "weight": "medium"
      }
    },
    "prerequisites": [],
    "leadsTo": [],
    "difficultyRange": [
      1,
      3
    ],
    "estimatedMinutes": {
      "concept": 10,
      "practice": 15
    },
    "content": {
      "variants": {
        "cie": [],
        "edexcel": [],
        "generic": []
      },
      "missions": [],
      "glGeneratorId": null,
      "examRefs": {
        "cie": 0,
        "edexcel": 0
      }
    },
    "noFigure": true,
    "isFoundational": true,
    "deprecated": false,
    "createdAt": "2026-04-06T16:01:38Z",
    "updatedAt": "2026-04-06T16:01:38Z"
  },
  {
    "kn_id": "kn_0005",
    "version": 1,
    "title_en": "Types of number",
    "title_zh": "数的类型",
    "domain": "number",
    "subdomain": "s1.1",
    "tags": [],
    "examBoards": {
      "cie_0580": {
        "section": "s1.1",
        "kpId": "kp-1.1-08",
        "tier": "both",
        "weight": "medium"
      }
    },
    "prerequisites": [],
    "leadsTo": [],
    "difficultyRange": [
      1,
      3
    ],
    "estimatedMinutes": {
      "concept": 10,
      "practice": 15
    },
    "content": {
      "variants": {
        "cie": [],
        "edexcel": [],
        "generic": []
      },
      "missions": [],
      "glGeneratorId": null,
      "examRefs": {
        "cie": 0,
        "edexcel": 0
      }
    },
    "noFigure": true,
    "isFoundational": true,
    "deprecated": false,
    "createdAt": "2026-04-06T16:01:38Z",
    "updatedAt": "2026-04-06T16:01:38Z"
  },
  {
    "kn_id": "kn_0007",
    "version": 1,
    "title_en": "Types of number",
    "title_zh": "数的类型",
    "domain": "number",
    "subdomain": "s1.1",
    "tags": [],
    "examBoards": {
      "cie_0580": {
        "section": "s1.1",
        "kpId": "kp-1.1-07",
        "tier": "both",
        "weight": "medium"
      }
    },
    "prerequisites": [],
    "leadsTo": [],
    "difficultyRange": [
      1,
      3
    ],
    "estimatedMinutes": {
      "concept": 10,
      "practice": 15
    },
    "content": {
      "variants": {
        "cie": [],
        "edexcel": [],
        "generic": []
      },
      "missions": [],
      "glGeneratorId": null,
      "examRefs": {
        "cie": 0,
        "edexcel": 0
      }
    },
    "noFigure": true,
    "isFoundational": true,
    "deprecated": false,
    "createdAt": "2026-04-06T16:01:38Z",
    "updatedAt": "2026-04-06T16:01:38Z"
  },
  {
    "kn_id": "kn_0008",
    "version": 1,
    "title_en": "Types of number",
    "title_zh": "数的类型",
    "domain": "number",
    "subdomain": "s1.1",
    "tags": [],
    "examBoards": {
      "cie_0580": {
        "section": "s1.1",
        "kpId": "kp-1.1-09",
        "tier": "both",
        "weight": "medium"
      }
    },
    "prerequisites": [],
    "leadsTo": [],
    "difficultyRange": [
      1,
      3
    ],
    "estimatedMinutes": {
      "concept": 10,
      "practice": 15
    },
    "content": {
      "variants": {
        "cie": [],
        "edexcel": [],
        "generic": []
      },
      "missions": [],
      "glGeneratorId": null,
      "examRefs": {
        "cie": 0,
        "edexcel": 0
      }
    },
    "noFigure": true,
    "isFoundational": true,
    "deprecated": false,
    "createdAt": "2026-04-06T16:01:38Z",
    "updatedAt": "2026-04-06T16:01:38Z"
  },
  {
    "kn_id": "kn_0009",
    "version": 1,
    "title_en": "Types of number",
    "title_zh": "数的类型",
    "domain": "number",
    "subdomain": "s1.1",
    "tags": [],
    "examBoards": {
      "cie_0580": {
        "section": "s1.1",
        "kpId": "kp-1.1-03",
        "tier": "both",
        "weight": "medium"
      }
    },
    "prerequisites": [],
    "leadsTo": [],
    "difficultyRange": [
      1,
      3
    ],
    "estimatedMinutes": {
      "concept": 10,
      "practice": 15
    },
    "content": {
      "variants": {
        "cie": [],
        "edexcel": [],
        "generic": []
      },
      "missions": [],
      "glGeneratorId": null,
      "examRefs": {
        "cie": 0,
        "edexcel": 0
      }
    },
    "noFigure": true,
    "isFoundational": true,
    "deprecated": false,
    "createdAt": "2026-04-06T16:01:38Z",
    "updatedAt": "2026-04-06T16:01:38Z"
  },
  {
    "kn_id": "kn_0011",
    "version": 1,
    "title_en": "Types of number",
    "title_zh": "数的类型",
    "domain": "number",
    "subdomain": "s1.1",
    "tags": [],
    "examBoards": {
      "cie_0580": {
        "section": "s1.1",
        "kpId": "kp-1.1-05",
        "tier": "both",
        "weight": "medium"
      }
    },
    "prerequisites": [],
    "leadsTo": [],
    "difficultyRange": [
      1,
      3
    ],
    "estimatedMinutes": {
      "concept": 10,
      "practice": 15
    },
    "content": {
      "variants": {
        "cie": [],
        "edexcel": [],
        "generic": []
      },
      "missions": [],
      "glGeneratorId": null,
      "examRefs": {
        "cie": 0,
        "edexcel": 0
      }
    },
    "noFigure": true,
    "isFoundational": true,
    "deprecated": false,
    "createdAt": "2026-04-06T16:01:38Z",
    "updatedAt": "2026-04-06T16:01:38Z"
  },
  {
    "kn_id": "kn_0012",
    "version": 1,
    "title_en": "Sets",
    "title_zh": "集合与韦恩图",
    "domain": "number",
    "subdomain": "s1.2",
    "tags": [],
    "examBoards": {
      "cie_0580": {
        "section": "s1.2",
        "kpId": "kp-1.2-01",
        "tier": "both",
        "weight": "medium"
      }
    },
    "prerequisites": [],
    "leadsTo": [],
    "difficultyRange": [
      1,
      3
    ],
    "estimatedMinutes": {
      "concept": 10,
      "practice": 15
    },
    "content": {
      "variants": {
        "cie": [],
        "edexcel": [],
        "generic": []
      },
      "missions": [],
      "glGeneratorId": null,
      "examRefs": {
        "cie": 0,
        "edexcel": 0
      }
    },
    "noFigure": true,
    "isFoundational": true,
    "deprecated": false,
    "createdAt": "2026-04-06T16:01:38Z",
    "updatedAt": "2026-04-06T16:01:38Z"
  },
  {
    "kn_id": "kn_0013",
    "version": 1,
    "title_en": "Sets",
    "title_zh": "集合与韦恩图",
    "domain": "number",
    "subdomain": "s1.2",
    "tags": [],
    "examBoards": {
      "cie_0580": {
        "section": "s1.2",
        "kpId": "kp-1.2-03",
        "tier": "both",
        "weight": "medium"
      }
    },
    "prerequisites": [],
    "leadsTo": [],
    "difficultyRange": [
      1,
      3
    ],
    "estimatedMinutes": {
      "concept": 10,
      "practice": 15
    },
    "content": {
      "variants": {
        "cie": [],
        "edexcel": [],
        "generic": []
      },
      "missions": [],
      "glGeneratorId": null,
      "examRefs": {
        "cie": 0,
        "edexcel": 0
      }
    },
    "noFigure": true,
    "isFoundational": true,
    "deprecated": false,
    "createdAt": "2026-04-06T16:01:38Z",
    "updatedAt": "2026-04-06T16:01:38Z"
  },
  {
    "kn_id": "kn_0014",
    "version": 1,
    "title_en": "Powers and roots",
    "title_zh": "幂与根",
    "domain": "number",
    "subdomain": "s1.3",